{
  "schema_version": "1.0",
  "pack_id": "eraser-cat-minimal",
  "meta": {
    "name": "Eraser Cat Minimal Pack",
    "created_at": "2026-03-02T00:00:00.000Z",
    "notes": "Vector placeholder pack for rig runtime."
  },
  "canvas": {
    "base_width": 1920,
    "base_height": 1080,
    "coord_space": "pixels"
  },
  "assets": {
    "images": {
      "torso": "shape://torso",
      "head": "shape://head",
      "upper_arm": "shape://upper_arm",
      "lower_arm": "shape://lower_arm",
      "paw": "shape://paw",
      "eye_left": "shape://eye_left",
      "eye_right": "shape://eye_right",
      "mouth": "shape://mouth",
      "eyelid": "shape://eyelid"
    }
  },
  "skeleton": {
    "bones": [
      {
        "bone_id": "root",
        "parent_id": "",
        "rest": {
          "x": 0,
          "y": 0,
          "rotation_deg": 0
        }
      },
      {
        "bone_id": "torso",
        "parent_id": "root",
        "rest": {
          "x": 0,
          "y": 0,
          "rotation_deg": 0
        }
      },
      {
        "bone_id": "head",
        "parent_id": "torso",
        "rest": {
          "x": 8,
          "y": -122,
          "rotation_deg": 0
        },
        "limits": {
          "min_rotation_deg": -35,
          "max_rotation_deg": 35
        }
      },
      {
        "bone_id": "upper_arm",
        "parent_id": "torso",
        "rest": {
          "x": 86,
          "y": -44,
          "rotation_deg": 10
        },
        "limits": {
          "min_rotation_deg": -120,
          "max_rotation_deg": 120
        }
      },
      {
        "bone_id": "lower_arm",
        "parent_id": "upper_arm",
        "rest": {
          "x": 96,
          "y": 0,
          "rotation_deg": 12
        },
        "limits": {
          "min_rotation_deg": -145,
          "max_rotation_deg": 145
        }
      }
    ],
    "attachments": [
      {
        "slot_id": "torso",
        "image_id": "torso",
        "bone_id": "torso",
        "pivot": {
          "px": 0.5,
          "py": 0.1
        }
      },
      {
        "slot_id": "head",
        "image_id": "head",
        "bone_id": "head",
        "pivot": {
          "px": 0.5,
          "py": 0.82
        }
      },
      {
        "slot_id": "eye_left",
        "image_id": "eye_left",
        "bone_id": "head",
        "pivot": {
          "px": 0.5,
          "py": 0.5
        },
        "offset": {
          "x": -18,
          "y": -18
        }
      },
      {
        "slot_id": "eye_right",
        "image_id": "eye_right",
        "bone_id": "head",
        "pivot": {
          "px": 0.5,
          "py": 0.5
        },
        "offset": {
          "x": 18,
          "y": -18
        }
      },
      {
        "slot_id": "mouth",
        "image_id": "mouth",
        "bone_id": "head",
        "pivot": {
          "px": 0.5,
          "py": 0.5
        },
        "offset": {
          "x": 0,
          "y": 16
        }
      },
      {
        "slot_id": "eyelid",
        "image_id": "eyelid",
        "bone_id": "head",
        "pivot": {
          "px": 0.5,
          "py": 0.1
        },
        "offset": {
          "x": 0,
          "y": -24
        }
      },
      {
        "slot_id": "upper_arm",
        "image_id": "upper_arm",
        "bone_id": "upper_arm",
        "pivot": {
          "px": 0.05,
          "py": 0.5
        }
      },
      {
        "slot_id": "lower_arm",
        "image_id": "lower_arm",
        "bone_id": "lower_arm",
        "pivot": {
          "px": 0.05,
          "py": 0.5
        }
      },
      {
        "slot_id": "paw",
        "image_id": "paw",
        "bone_id": "lower_arm",
        "pivot": {
          "px": 0.5,
          "py": 0.5
        },
        "offset": {
          "x": 90,
          "y": 0
        }
      }
    ]
  },
  "slots": [
    {
      "slot_id": "torso",
      "default_image_id": "torso",
      "z_index": 1
    },
    {
      "slot_id": "upper_arm",
      "default_image_id": "upper_arm",
      "z_index": 2
    },
    {
      "slot_id": "head",
      "default_image_id": "head",
      "z_index": 3
    },
    {
      "slot_id": "eye_left",
      "default_image_id": "eye_left",
      "z_index": 4
    },
    {
      "slot_id": "eye_right",
      "default_image_id": "eye_right",
      "z_index": 4
    },
    {
      "slot_id": "mouth",
      "default_image_id": "mouth",
      "z_index": 4
    },
    {
      "slot_id": "lower_arm",
      "default_image_id": "lower_arm",
      "z_index": 5
    },
    {
      "slot_id": "paw",
      "default_image_id": "paw",
      "z_index": 6
    },
    {
      "slot_id": "eyelid",
      "default_image_id": "eyelid",
      "z_index": 7
    }
  ],
  "visemes": {},
  "expressions": {},
  "clips": [],
  "ik_chains": [
    {
      "chain_id": "right-arm",
      "bones": ["upper_arm", "lower_arm"],
      "effector_bone_id": "lower_arm",
      "elbow_hint": "down",
      "max_stretch": 1.05
    }
  ]
}